{
  "topic_id": "us_rate",
  "as_of": "2026-10-31",
  "current": {
    "indicators": [
      {
        "series_id": "us_ffr_upper",
        "name": "FFR 목표 상단",
        "value": 4.0,
        "unit": "%",
        "as_of": "2026-10-28",
        "source": "https://www.cnbc.com/2026/10/28/fed-interest-rate-decision-october-2026.html",
        "value_flag": "웹확인",
        "stale": false
      },
      {
        "series_id": "us_ffr_lower",
        "name": "FFR 목표 하단",
        "value": 3.75,
        "unit": "%",
        "as_of": "2026-10-28",
        "source": "https://www.cnbc.com/2026/10/28/fed-interest-rate-decision-october-2026.html",
        "value_flag": "웹확인",
        "stale": false
      },
      {
        "series_id": "us_eff_ffr",
        "name": "실효 연방기금금리(EFFR)",
        "value": null,
        "unit": "%",
        "as_of": null,
        "value_flag": "미확인"
      },
      {
        "series_id": "us_cpi_yoy",
        "name": "CPI 전년비 (2026년 9월분, 10/14 발표)",
        "value": 3.7,
        "unit": "%",
        "as_of": "2026-09",
        "chg_1m": null,
        "source": "https://investinglive.com/news/us-september-cpi-vs-3-6-expected-0/",
        "value_flag": "웹확인",
        "stale": false
      },
      {
        "series_id": "us_core_cpi_yoy",
        "name": "Core CPI 전년비 (2026년 9월분)",
        "value": 2.6,
        "unit": "%",
        "as_of": "2026-09",
        "chg_1m": null,
        "source": "https://investinglive.com/news/us-september-cpi-vs-3-6-expected-0/",
        "value_flag": "웹확인",
        "stale": false
      },
      {
        "series_id": "us_core_pce_yoy",
        "name": "Core PCE 전년비 (2026년 8월분, 9/30 발표)",
        "value": 3.1,
        "unit": "%",
        "as_of": "2026-09",
        "source": "https://tradingeconomics.com/united-states/core-pce-price-index-annual-change/news/596316",
        "value_flag": "웹확인",
        "stale": false
      },
      {
        "series_id": "us_nfp_chg",
        "name": "비농업고용(NFP) 증감 (2026년 9월분)",
        "value": 29,
        "unit": "천명",
        "as_of": "2026-09",
        "chg_1m": null,
        "source": "https://www.bls.gov/news.release/archives/empsit_10022026.htm",
        "value_flag": "웹확인",
        "stale": false
      },
      {
        "series_id": "us_unemployment",
        "name": "실업률 (2026년 9월분)",
        "value": 4.2,
        "unit": "%",
        "as_of": "2026-09",
        "chg_1m": null,
        "source": "https://www.bls.gov/news.release/archives/empsit_10022026.htm",
        "value_flag": "웹확인",
        "stale": false
      },
      {
        "series_id": "us_pce_yoy",
        "name": "PCE 물가 전년비",
        "value": 3.6,
        "unit": "%",
        "as_of": "2026-09",
        "value_flag": "웹확인",
        "source": "https://www.foxbusiness.com/economy/september-2026-pce-inflation",
        "stale": false
      }
    ],
    "summary": "[사실] FOMC는 2026-10-28 FFR 3.75~4.00%를 동결했다(10대 2). 쿡 이사와 해맥 클리블랜드 총재가 25bp 인상을 주장하며 반대했다(웹확인). [사실] 성명서는 인플레이션이 '여전히 높다'고 평가하고 추가 조치 전 '정보 축적'을 기다린다고 밝혔다. 워시 의장은 포워드 가이던스를 피했다(웹확인). [사실] 9월 PCE 3.6%·근원 PCE 3.1%(10/29 발표, 8월 3.0%에서 상승, 웹확인), 9월 CPI 3.7%·NFP +2.9만명·실업률 4.2%. 9월 SEP 2026년 말 중간값 4.1%. [하우스] 신한은 성명서·의장 발언에서 인상을 서두르는 뉘앙스가 빠져 비둘기파적으로 해석됐다고 정리(20261030_신한_채권전략_QRA p.6). [판단] 12월 25bp 인상 가능성은 열려 있으나 10월 고용·물가 확인이 조건."
  },
  "short_term": {
    "horizon": "3-6M",
    "direction": "소폭 상승(25bp 1회 인상 후 동결)",
    "view": "[판단] 12월 또는 2027년 1분기 25bp 추가 인상(상단 4.25%) 후 동결을 기본으로 유지한다. 인상 소수의견 2명과 근원 PCE 3.1% 재상승이 인상 옵션을 살려두지만, 의장이 서두르지 않는 태도를 보여 시점은 데이터 의존적이다. [하우스] 신한 월간 자산전략: 시장은 2~3차례 인상 가능성을 선반영했고 '보험성 금리 인하' 의심도 잔존, 긴축 후반부·금리 고원 장기화(20261030_신한_BlueBook11월_자산전략 p.3-5). [하우스] 신한 채권전략: 10월 FOMC는 비둘기파적 해석(20261030_신한_채권전략_QRA p.6). [판단] 10월 고용(11/6, 시장 예상 +6.5만명)이 다시 부진하면 인상 보류 가능성이 커져 확신도는 중간.",
    "drivers": [
      "[사실] 10/28 FOMC 3.75~4.00% 동결, 10대 2(인상 소수의견: 쿡·해맥)",
      "[사실] 9월 PCE 3.6%·근원 3.1%(10/29 발표)",
      "[사실] 9월 CPI 3.7%·근원 2.6%, NFP +2.9만명·실업률 4.2%",
      "[사실] SEP 중간값 2026년 말 4.1%·2027년 4.1%·2028년 3.9%",
      "[사실] 10월 NFP 11/6 발표(예상 +6.5만명), 미시간 1년 기대인플레 4.7%(이전치, 20261030_신한_채권전략_QRA p.8)",
      "[판단] 11/3 중간선거 후 분점 정부 가능성 — 재정 변수 약화, 통화정책·펀더멘털 비중 확대(20261030_신한_채권전략_QRA p.3, p.5)"
    ],
    "confidence": "중간"
  },
  "long_term": {
    "horizon": "1-3Y",
    "scenarios": [
      {
        "name": "Base",
        "prob": 0.5,
        "headline": "FFR 상단이 4.25%에서 정점을 찍고 2027년 동결 후 2028년 4.00% 내외로 돌아온다(현재 대비 0bp).",
        "narrative": "[판단] 2026년 말~2027년 1분기 상단 4.25%에서 정점, 2027년 동결 후 2028년 소폭 인하해 상단 4.00% 내외(SEP 2028년 3.9%와 정합).",
        "factor_shocks": {
          "us_ffr_bp": 0
        },
        "shock_rationale": "현재 상단 4.00% → 정점 4.25% 후 4.00%로 복귀: 기준일 대비 0bp"
      },
      {
        "name": "Bull",
        "prob": 0.25,
        "headline": "물가가 빠르게 둔화해 2027년 중 인하로 돌아서 상단 3.00% 내외까지 내린다(−100bp).",
        "narrative": "[판단] 유가 진정과 고용 악화로 물가가 빠르게 둔화, 2027년 중 인하 사이클 전환해 상단 3.00% 내외. [하우스] NH의 인하 사이클 시각(터미널 3.25%, 20260526_NH_2026하반기FICC채권전망 p.29, 2026-05 발간)과 방향은 같으나, NH 단기 콜은 9월 인상으로 이미 빗나가 확률 상향 근거로 쓰지 않음.",
        "factor_shocks": {
          "us_ffr_bp": -100
        },
        "shock_rationale": "추가 인상 없이 25bp 4회 인하: -100bp"
      },
      {
        "name": "Bear",
        "prob": 0.25,
        "headline": "에너지 충격이 물가로 번져 세 번 더 올리고 상단 4.75%를 장기 유지한다(+75bp).",
        "narrative": "[판단] 에너지 충격이 기대인플레이션·Core로 전이되어 25bp 3회 추가 인상, 상단 4.75%에서 장기 유지.",
        "factor_shocks": {
          "us_ffr_bp": 75
        },
        "shock_rationale": "추가 인상 3회: +75bp"
      }
    ]
  },
  "house_views": {
    "consensus": "[갱신 2026-10-31] 10월 FOMC는 하우스 예상(동결) 그대로 실현. 신한 채권전략은 결과를 비둘기파적으로 해석(20261030_신한_채권전략_QRA p.6), 월간 자산전략은 긴축 후반부·금리 고원 장기화를 제시(20261030_신한_BlueBook11월_자산전략 p.4). Base(4.25% 정점 후 4.00% 복귀) 유지. [이전] [하우스] 동일 주간 2곳(신한·미래에셋) 강한 공통: 10월 FOMC(10/27~28) 동결 + 매파적 기조. 신한은 에너지발 비용 압력·실물 양호를 근거로 매파적 동결(확신 높음, 20261023_신한_WeeklyGuideBook p.3; 확신 중간, 20261023_신한_EconCheckup p.1). 미래에셋은 만장일치 동결, AI 투자·유가의 물가 영향 관망 재확인 예상(확신 중간, 20261023_미래_MacroWeekAhead p.1), 코어 인플레이션 재가속으로 매파 기조 유지 가능성 높음(확신 낮음, 20261022_미래_FixedIncomeComment_10월금통위 p.2). [하우스] 지연 참고(NH, 2026-05-26): 기대인플레 자극 시 '동결 장기화/인상 우려 재부상'을 핵심 리스크로 명시(20260526_NH_2026하반기FICC채권전망 p.2, p.8) — 실제 전개는 이 리스크에 가까움. [갱신 2026-10-26] 신한 연간 전망: 미국은 인상 마무리 구간, 2027년 상반기 동결 유지(장기금리가 긴축 대체), 하반기 과잉 긴축 경계 속 완만한 인하 여지(20261026_신한_2027전망P3_정책금융취약성 p.2, p.6). 외환 파트는 2026년 12월 마지막 인상을 가정하고 하반기 '연준 4.00% 동결'을 전제(20261026_신한_2027전망P5_외환 p.2, p.7; 상·하단 미표기). [판단] Base(4.25% 정점 후 4.00% 복귀)와 방향 일치 — 충격값 유지.",
    "divergence": "[하우스] 동일 주간 2곳 간 차이는 추가 인상 옵션의 언급 여부뿐: 신한은 연준이 추가 인상 옵션을 열어둘 것으로 판단(확신 낮음, 시점 미확정, 20261023_신한_WeeklyGuideBook p.3), 미래에셋은 추가 인상 경로를 제시하지 않고 동결·관망만 언급(20261023_미래_MacroWeekAhead p.1). 두 하우스 모두 정책금리 수준 전망은 미제시. [하우스] 지연 참고(NH, 2026-05 발간·약 5개월 시차): 12월 25bp 인하(4Q26 말 3.50%)·터미널 3.25%(20260526_NH_2026하반기FICC채권전망 p.2, p.29, p.89). [사실] NH 12월 인하 콜은 미실현 — 2026-09-16 FOMC가 25bp 인상해 3.75~4.00%, SEP 2026년 말 중간값 4.1%. [판단] NH 경로는 Bull 시나리오의 방향 참고로만 사용. [갱신 2026-10-31] 인상 경로: 시장은 2~3차례 인상을 선반영(신한 자산전략 p.5 인용)했지만 우리 Base는 1회. 시장 프라이싱이 Bear 쪽에 가깝다는 점은 리스크로 기록.",
    "cards_used": [
      "20261023_신한_EconCheckup",
      "20261023_신한_WeeklyGuideBook",
      "20260526_NH_2026하반기FICC채권전망",
      "20261022_미래_FixedIncomeComment_10월금통위",
      "20261023_미래_MacroWeekAhead",
      "20261026_신한_2027전망P3_정책금융취약성",
      "20261026_신한_2027전망P5_외환",
      "20261030_신한_채권전략_QRA",
      "20261030_신한_BlueBook11월_자산전략"
    ]
  },
  "short_term_factor_shocks": {
    "us_ffr_bp": 25
  },
  "short_term_shock_rationale": "12월 또는 2027년 1분기 25bp 추가 인상 1회(SEP 중간값 정합): +25bp — 미래에셋 카드 추가 후에도 변경 없음(동결·매파 기조는 기존 가정과 일치)",
  "data_gaps": [
    "API 데이터 미수집 (FRED API 차단으로 latest_snapshot.json에 미국 시계열 없음) — 모든 현황 수치는 웹확인 값",
    "하우스 2곳 동일 주간(신한·미래에셋) + NH(2026-05, 구조적 참고)",
    "SEP 수치와 FedWatch 확률은 2차 보도 경유(공식 원문 직접 조회 실패: federalreserve.gov/CME 접속 불가)",
    "EFFR·9월 이후 RMP 속도 미확인",
    "FOMC 결과·PCE는 언론 보도 기준(웹확인) — 연준·BEA 원문 대조 미실시"
  ],
  "sources": [
    "data/latest_snapshot.json (미국 시계열 없음)",
    "knowledge/view_cards/20261023_신한_EconCheckup",
    "knowledge/view_cards/20261023_신한_WeeklyGuideBook",
    "https://www.federalreserve.gov/newsevents/pressreleases/monetary20260916a.htm",
    "https://www.federalreserve.gov/monetarypolicy/fomcprojtabl20260916.htm",
    "https://www.tmgm.com/es/analysis/market-news/article/fed-raises-2026-interest-rate-forecast-to-41-lifts-pce-inflation-projections-202609161858 (보조)",
    "https://www.bls.gov/news.release/archives/empsit_10022026.htm",
    "https://investinglive.com/news/us-september-cpi-vs-3-6-expected-0/",
    "https://tradingeconomics.com/united-states/core-pce-price-index-mom/news/588257",
    "https://www.noradarealestate.com/blog/interest-rate-predictions-october-2026/ (보조)",
    "https://www.federalreserve.gov/monetarypolicy/2026-07-mpr-part2.htm",
    "knowledge/view_cards/20260526_NH_2026하반기FICC채권전망.json",
    "knowledge/view_cards/20261022_미래_FixedIncomeComment_10월금통위.json",
    "knowledge/view_cards/20261023_미래_MacroWeekAhead.json",
    "knowledge/view_cards/20261026_신한_2027전망P3_정책금융취약성.json",
    "knowledge/view_cards/20261026_신한_2027전망P5_외환.json",
    "knowledge/view_cards/20261030_신한_채권전략_QRA.json",
    "knowledge/view_cards/20261030_신한_BlueBook11월_자산전략.json",
    "https://www.cnbc.com/2026/10/28/fed-interest-rate-decision-october-2026.html",
    "https://www.cnn.com/2026/10/28/business/live-news/federal-reserve-interest-rate-october",
    "https://tradingeconomics.com/united-states/core-pce-price-index-annual-change/news/596316",
    "https://www.foxbusiness.com/economy/september-2026-pce-inflation"
  ]
}
