{
  "topic_id": "us_treasury",
  "as_of": "2026-10-25",
  "current": {
    "indicators": [
      {"series_id": "ust_2y", "name": "UST 2년", "value": 4.686, "unit": "%", "as_of": "2026-10-23", "chg_1m": null, "source": "https://www.cnbc.com/2026/10/23/bonds-yields-us-treasurys.html", "value_flag": "웹확인", "stale": false},
      {"series_id": "ust_10y", "name": "UST 10년", "value": 4.999, "unit": "%", "as_of": "2026-10-23", "chg_1m": null, "source": "https://www.cnbc.com/2026/10/23/bonds-yields-us-treasurys.html", "value_flag": "웹확인", "stale": false},
      {"series_id": "ust_30y", "name": "UST 30년", "value": 5.312, "unit": "%", "as_of": "2026-10-23", "chg_1m": null, "source": "https://www.cnbc.com/2026/10/23/bonds-yields-us-treasurys.html", "value_flag": "웹확인", "stale": false},
      {"series_id": "ust_10y_2y", "name": "UST 10Y-2Y (웹확인 10Y·2Y로 산출)", "value": 0.313, "unit": "%", "as_of": "2026-10-23", "source": "https://www.cnbc.com/2026/10/23/bonds-yields-us-treasurys.html", "value_flag": "웹확인", "stale": false},
      {"series_id": "ust_10y_2y_fred", "name": "UST 10Y-2Y (FRED T10Y2Y)", "value": 0.33, "unit": "%", "as_of": "2026-10-20", "source": "https://fred.stlouisfed.org/graph/?g=KWqs", "value_flag": "웹확인", "stale": false},
      {"series_id": "us_bei_10y", "name": "10년 기대인플레이션(BEI)", "value": 2.35, "unit": "%", "as_of": "2026-10-16", "source": "https://govspending.org/series/T10YIE/", "value_flag": "웹확인", "stale": true}
    ],
    "summary": "[사실] API 데이터 미수집으로 모든 수치는 웹확인 값이다. [사실] 2026-10-23 기준 UST 2년 4.686%, 10년 4.999%, 30년 5.312%(CNBC). [사실] 10년물은 10/7 약 5.35%(2002년 이후 최고)까지 오른 뒤 AI 관련 위험회피로 5% 부근으로 내려왔다. [사실] 10Y-2Y는 산출값 31.3bp(10/23), FRED T10Y2Y 0.33%p(10/20)로 대체로 일치한다(기준일 차이 3일). [사실] 10년 BEI 2.35%(2026-10-16, FRED 미러 사이트 기준, 9일 경과 — stale 경고). [판단] BEI가 2.3%대에 머무는데 10년 명목이 5% 부근이라는 점은 상승분의 대부분이 실질금리·term premium(재정 우려)에서 나온 것으로 해석된다."
  },
  "short_term": {
    "horizon": "3-6M",
    "direction": "고점권 박스, 커브 완만한 스티프닝",
    "view": "[판단] 2년물은 12월 인상이 상당 부분 반영(약 71%)되어 추가 상승 여지가 제한적이고, 10년물은 5% 내외 박스권, 30년물은 재정·공급 부담으로 상대적으로 높게 유지될 것으로 본다. 커브는 소폭 스티프닝 쪽. [하우스][20261023_샘플_가상MacroWeekly] 가상 샘플 카드는 인하 기대를 근거로 10년 하락, 2s10s 확대를 전망(확신도 중간, p.1) — 스티프닝 방향은 일치하나 근거(인하)는 현 정책 경로와 상충.",
    "drivers": [
      "[사실] 9월 CPI 3.7% 상회, 12월 인상 확률 약 71%(CME FedWatch, 10/23 보도)",
      "[사실] 10년물 10/7 약 5.35% 고점 후 5% 하회 시도 — 위험회피 수요",
      "[판단] 재정적자·쿠폰 발행 비중에 따른 term premium 상방 압력 (재무부 QRA 최신 내용 미확인)",
      "[사실] BEI 2.35%로 기대인플레이션은 안정적 (2026-10-16)",
      "[판단] 고용 둔화 지속 시 2년물 하락 → 불 스티프닝 가능"
    ],
    "confidence": "낮음"
  },
  "long_term": {
    "horizon": "1-3Y",
    "scenarios": [
      {"name": "Base", "prob": 0.5, "narrative": "[판단] FFR 정점 후 2027년 하반기부터 완만한 인하, 단기물 중심 하락. term premium은 재정 부담으로 높게 유지되어 커브 스티프닝(2s10s 60~70bp 내외).", "factor_shocks": {"ust_2y_bp": -60, "ust_10y_bp": -25, "ust_30y_bp": -10}, "shock_rationale": "FFR Base -50bp에 2년 연동, 10·30년은 term premium 유지로 하락폭 축소"},
      {"name": "Bull", "prob": 0.25, "narrative": "[판단] 유가 하락·경기 둔화로 인하 사이클 본격화, 장단기 모두 하락(불 스티프닝).", "factor_shocks": {"ust_2y_bp": -120, "ust_10y_bp": -70, "ust_30y_bp": -50}, "shock_rationale": "FFR Bull -100bp + 경기둔화 안전자산 수요 반영"},
      {"name": "Bear", "prob": 0.25, "narrative": "[판단] 인플레이션 고착으로 추가 인상, 재정 우려 확대로 term premium 상승 — 베어 스티프닝, 10년 5.5%+ 재시험.", "factor_shocks": {"ust_2y_bp": 60, "ust_10y_bp": 60, "ust_30y_bp": 70}, "shock_rationale": "FFR Bear +75bp에 2년 연동, 장기물은 term premium 추가 상승으로 30년 상승폭 확대"}
    ]
  },
  "house_views": {
    "consensus": "[하우스] 실제 하우스 뷰 없음. 가상 샘플 카드 20261023_샘플_가상MacroWeekly는 10년 단기 하락(확신 중간)·2s10s 확대(확신 중간)를 제시(p.1), 목표 수준 없음.",
    "divergence": "하우스 1곳(가상 샘플)뿐이라 하우스 간 이견 판단 불가.",
    "cards_used": ["20261023_샘플_가상MacroWeekly"]
  },
  "short_term_factor_shocks": {"ust_2y_bp": 5, "ust_10y_bp": 0, "ust_30y_bp": 10},
  "short_term_shock_rationale": "12월 인상 대부분 기반영으로 2년 +5bp, 10년 5% 박스로 0bp, 30년은 공급·term premium 부담으로 +10bp (완만한 스티프닝)",
  "data_gaps": [
    "API 데이터 미수집 (latest_snapshot.json 비어 있음 — FRED no_key): 모든 현황 수치는 웹확인 값, chg_1m 미확인",
    "us_bei_10y: 기준일 2026-10-16, 9일 경과 (stale), 출처가 FRED 미러(govspending.org)로 FRED 원본 미검증",
    "ust_10y_2y_fred 값은 FRED 그래프 검색 결과 기준(2026-10-20)으로 원본 페이지 직접 확인 안 함",
    "재무부 QRA(쿠폰 vs T-bill 구성), QT 속도 최신 정보 미확인",
    "하우스 뷰 부족 (30일 이내 카드 1개, 하우스 1곳)",
    "유일한 카드 20261023_샘플_가상MacroWeekly는 가상 샘플 리포트로 실제 하우스 뷰가 아님"
  ],
  "sources": [
    "data/latest_snapshot.json (비어 있음)",
    "knowledge/view_cards/20261023_샘플_가상MacroWeekly (가상 샘플)",
    "https://www.cnbc.com/2026/10/23/bonds-yields-us-treasurys.html",
    "https://www.cnbc.com/2026/10/05/treasury-yields-fiscal-concerns-not-crisis-yet.html",
    "https://fred.stlouisfed.org/graph/?g=KWqs",
    "https://govspending.org/series/T10YIE/",
    "https://www.cnbc.com/2026/10/14/cpi-inflation-report-september-2026.html"
  ]
}
