{
  "topic_id": "kr_govt_bond",
  "as_of": "2026-10-26",
  "current": {
    "indicators": [
      {
        "series_id": "ktb_3y",
        "name": "국고채 3년",
        "value": 3.803,
        "unit": "%",
        "as_of": "2026-10-23",
        "value_flag": "수기",
        "source": "data/latest_snapshot.json (data/manual/ecos100_20261025.yaml, ECOS 100대 통계지표 수기 입력)"
      },
      {
        "series_id": "ktb_5y",
        "name": "국고채 5년",
        "value": 3.948,
        "unit": "%",
        "as_of": "2026-10-23",
        "value_flag": "수기",
        "source": "data/latest_snapshot.json (data/manual/ecos100_20261025.yaml, ECOS 100대 통계지표 수기 입력)"
      },
      {
        "series_id": "ktb_10y",
        "name": "국고채 10년",
        "value": 4.097,
        "unit": "%",
        "as_of": "2026-10-23",
        "value_flag": "웹확인",
        "source": "https://www.etoday.co.kr/news/view/2639582"
      },
      {
        "series_id": "ktb_30y",
        "name": "국고채 30년",
        "value": 4.189,
        "unit": "%",
        "as_of": "2026-10-23",
        "value_flag": "웹확인",
        "source": "https://www.etoday.co.kr/news/view/2639582"
      },
      {
        "series_id": "ktb_10y_3y",
        "name": "국고채 10Y-3Y (10년 웹확인 − 3년 수기로 계산)",
        "value": 0.294,
        "unit": "%p",
        "as_of": "2026-10-23",
        "value_flag": "웹확인",
        "source": "https://www.etoday.co.kr/news/view/2639582"
      },
      {
        "series_id": "ktb_30y_10y",
        "name": "국고채 30Y-10Y (웹확인 값으로 계산)",
        "value": 0.092,
        "unit": "%p",
        "as_of": "2026-10-23",
        "value_flag": "웹확인",
        "source": "https://www.etoday.co.kr/news/view/2639582"
      },
      {
        "series_id": "kr_bond_trading_value",
        "name": "채권거래대금",
        "value": 81.0,
        "unit": "조원",
        "as_of": "2026-10-25",
        "value_flag": "수기",
        "source": "data/latest_snapshot.json (data/manual/ecos100_20261025.yaml, ECOS 100대 통계지표 수기 입력)"
      },
      {
        "series_id": "ktb_issuance",
        "name": "국고채발행액",
        "value": 21228.0,
        "unit": "십억원",
        "as_of": "2026-08-31",
        "value_flag": "수기",
        "source": "data/latest_snapshot.json (data/manual/ecos100_20261025.yaml, ECOS 100대 통계지표 수기 입력)",
        "stale": true
      }
    ],
    "summary": "[사실] 2026-10-23 마감 국고 3년 3.803%·5년 3.948%(수기), 10년 4.097%·30년 4.189%(웹확인, 이투데이). [사실] 10/23 미 국채 강세(AI 투자 수익성 우려·중동 불안에 따른 안전자산 선호)로 전 구간 하락: 3년 -3.7bp, 10년 -5.5bp(6/30 이후 최저), 30년 -5.0bp. [사실] 10Y-3Y 29.4bp, 30Y-10Y +9.2bp로 30-10 역전 아님(웹확인·수기 값으로 계산). 10/1 30년 4.538% 대비 약 35bp 하락해 장기물 중심 강세. [사실] 3년물은 기준금리(3.00%) 대비 +80bp로 추가 인상 2~3회를 선반영. [주의] 국고채발행액은 기준일 2026-08-31, 55일 경과(stale)."
  },
  "short_term": {
    "horizon": "3-6M",
    "direction": "단기물 소폭 상승·장기물 보합(베어 플래트닝)",
    "view": "[하우스] 신한투자증권은 9월 말 이후 강세가 상당 부분 가격에 반영돼 금리가 바닥을 다지는 국면이며, 차주 3년 3.70~3.85%·10년 4.00~4.15% 밴드에서 약보합(금리 소폭 상승) 예상(20261022_신한_10월금통위 p.1, 20261023_신한_WeeklyGuideBook p.9). [하우스] 미래에셋은 듀레이션 중립·금리 하락 시 일부 차익실현, 원화채 추격 매수 자제를 권고(20261022_미래_FixedIncomeComment_10월금통위 p.1-2; 20261023_미래_MacroWeekAhead p.1) — 신한과 양립 가능. [판단] 현 3년 3.803%는 밴드 상단, 10년 4.097%는 중하단. 실제 추가 인상이 확인되면 3년물이 소폭 더 오르고, 장기물은 정부의 발행 축소·바이백과 보험사 ALM 수요로 상대적으로 견조해 커브는 플래트닝 편향. [판단] 미 금리 하락·위험회피가 이어지면 하방(강세) 위험도 존재.",
    "drivers": [
      "[사실] 기준금리 3.00% 동결·추가 인상 기조 유지(2026-10-22)",
      "[사실] 10월 국고채 바이백 3.5조원(2·3·5·10년 경과종목) 및 발행물량 추가 축소 검토(재정경제부 10월 계획 보도)",
      "[사실] 11월 국고채 발행계획 미발표(미확인)",
      "[사실] 10/23 50년-30년 금리차 상장 이래 최대(이투데이) — 30년 구간 상대 강세",
      "[사실] 외국인: WGBI 편입(2026-03-30~) 후 3월 말~5월 초 순매수 14조원+ 보도, 10월 수급은 미확인",
      "[판단] 3Q GDP·10월 CPI·FOMC·미 PCE가 긴축 경계로 금리 하단 지지",
      "[판단] 미 장기금리 연동: 10/23 강세는 미 국채 주도 — us-fixed-income과 일관성 확인 필요"
    ],
    "confidence": "중간"
  },
  "long_term": {
    "horizon": "1-3Y",
    "scenarios": [
      {
        "name": "Base",
        "prob": 0.45,
        "headline": "기준금리 3.50% 정점 후 3년물 +15bp, 10년물 +10bp, 30년물 +5bp로 소폭 오르며 커브가 평탄해진다.",
        "narrative": "[판단] 기준금리 3.50%에서 정점 후 동결. 3년물은 기반영분이 커 소폭 상승, 장기물은 공급 관리·보험사 ALM 수요로 상승 폭 제한 → 커브 플래트닝. [하우스] NH의 30-10 스프레드 확대(보험사 초장기 수요 약화·초장기 발행 증가) 구조 뷰(20260526_NH_2026하반기FICC채권전망 p.84-86, 2026-05 발간, 확신 낮음)는 장기물 상대 강세 가정의 반대 리스크로 인지 — 조건부 견해라 충격값은 유지.",
        "factor_shocks": {
          "ktb_3y_bp": 15,
          "ktb_10y_bp": 10,
          "ktb_30y_bp": 5
        },
        "shock_rationale": "기준금리 +50bp 중 3년물 기반영(+80bp) 감안 +15bp, 10·30년은 수급 개선으로 +10/+5bp. 확률 0.55 → 0.45(kr_rate Base 확률 조정과 일치), 충격값 유지(시나리오 정의 불변)"
      },
      {
        "name": "Bull",
        "prob": 0.3,
        "headline": "인하 전환과 외국인 자금 유입으로 3년 −50bp, 10년 −45bp, 30년 −40bp의 전 구간 강세가 나타난다.",
        "narrative": "[판단] 기준금리 3.25%(미래에셋 터미널, 20261022_미래_FixedIncomeComment_10월금통위 p.1-2)에서 정점 후 2027년 하반기~2028년 인하 전환, 미 금리 하락·외국인 WGBI 자금 재유입으로 전 구간 강세.",
        "factor_shocks": {
          "ktb_3y_bp": -50,
          "ktb_10y_bp": -45,
          "ktb_30y_bp": -40
        },
        "shock_rationale": "기준금리 순 -25bp + 기반영 인상 프리미엄 해소로 3년 -50bp, 장기물은 기간프리미엄 잔존으로 낙폭 소폭 작음. 확률 0.20 → 0.30(kr_rate Bull과 일치), 충격값 유지"
      },
      {
        "name": "Bear",
        "prob": 0.25,
        "headline": "인상 연장과 국고채 발행 확대로 3년 +45bp, 10년 +55bp, 30년 +50bp 오르는 베어 스티프닝이 나타난다.",
        "narrative": "[판단] 인상이 3.75% 이상으로 연장되고 확장재정·국고채 발행 확대, 미 장기금리 재상승이 겹쳐 베어 스티프닝.",
        "factor_shocks": {
          "ktb_3y_bp": 45,
          "ktb_10y_bp": 55,
          "ktb_30y_bp": 50
        },
        "shock_rationale": "기준금리 +75bp 중 미반영분 + 공급·기간프리미엄 확대로 10년이 가장 크게 상승, 30년은 ALM 수요로 일부 상쇄"
      }
    ]
  },
  "house_views": {
    "consensus": "[하우스] 동일 주간 2곳(신한·미래에셋) 공통: 국고채 강세 추격에 신중. 신한은 9월 말 이후 강세가 상당 부분 반영돼 바닥 다지기, 차주 3년 3.70~3.85%·10년 4.00~4.15% 밴드에서 약보합(금리 소폭 상승 편향) 예상(20261022_신한_10월금통위 p.1; 20261023_신한_WeeklyGuideBook p.9). 미래에셋은 총재 발언의 비둘기적 해석으로 금리가 반락했으나 3Q GDP·미 물가·연준 경로에 따른 대외금리 변동성을 경계해 듀레이션 중립·금리 하락 시 일부 차익실현을 권고(20261022_미래_FixedIncomeComment_10월금통위 p.1-2), 미 중간선거(11/3)·유가 경로 확인 전까지 원화채 추격 매수보다 듀레이션 중립(20261023_미래_MacroWeekAhead p.1). [판단] 두 하우스 시각은 양립 가능(밴드 상단 근처 약세 편향 vs 강세 시 이익실현 — 모두 '추격 매수 자제'). [하우스] 지연 참고(NH, 2026-05-26, 구조적 참고): 한국 국채 투자의견 중립·3년 이하 선호(20260526_NH_2026하반기FICC채권전망 p.4), 10년 4.3% 부근 강한 저항(p.80). [갱신 2026-10-26] 신한 연간 전망: 반도체 법인세 급증으로 적자가 줄어 국고채 발행 부담 완화, 미래대응기금 중 12.5조원은 국채발행 축소 재원(확신 낮음, 20261026_신한_2027전망P3_정책금융취약성 p.8, p.11; 20261026_신한_2027전망P4_주요국한국경제 p.16). [판단] 장기물 상대 강세(플래트닝) 가정의 수급 근거를 보강 — 충격값 유지. 반대로 2027년 총지출 +12.8%(같은 카드 p.16)는 공급 측 부담 요인.",
    "divergence": "[하우스] 동일 주간 2곳 간 차이는 강도·형식: 신한은 수치 밴드와 소폭 상승 방향을 제시(20261023_신한_WeeklyGuideBook p.9), 미래에셋은 수치 전망 없이 포지션(듀레이션 중립·랠리 시 차익실현) 권고만 제시(20261022_미래_FixedIncomeComment_10월금통위 p.1-2; 20261023_미래_MacroWeekAhead p.1). 배경 기준금리 경로는 신한 3.50% vs 미래에셋 3.25% 터미널로 25bp 차이(kr_rate 참조) — 미래에셋 쪽이 3년물 기반영분(+80bp) 해소 여지를 더 크게 시사. [하우스] 지연 참고(NH, 2026-05 발간·약 5개월 시차): 4Q26 평균 3년 3.65%·10년 4.00%, 2027년 연평균 3.50%·3.80%의 하향 경로(20260526_NH_2026하반기FICC채권전망 p.77, p.80-82, p.87-89). [사실] 현재 3년 3.803%(수기, 2026-10-23)·10년 4.097%(웹확인, 2026-10-23)로 NH 4Q 평균보다 약 +15bp·+10bp 높다. [판단] NH 전제(터미널 3.00%·연준 12월 인하)는 연준 9월 인상과 두 하우스의 11월 인상 예상으로 약화. [하우스] 구조적 참고: NH는 보험사 초장기 수요 약화·2027년 초장기 발행 증가 시 30-10 스프레드 확대 가능성(확신 낮음·조건부, p.84-86). 신한·미래에셋은 30년물 직접 견해 없음. [사실] 현재 30Y-10Y +9.2bp로 역전 아님.",
    "cards_used": [
      "20261022_신한_10월금통위",
      "20261023_신한_WeeklyGuideBook",
      "20260526_NH_2026하반기FICC채권전망",
      "20261022_미래_FixedIncomeComment_10월금통위",
      "20261023_미래_MacroWeekAhead",
      "20261026_신한_2027전망P3_정책금융취약성",
      "20261026_신한_2027전망P4_주요국한국경제"
    ]
  },
  "short_term_factor_shocks": {
    "ktb_3y_bp": 10,
    "ktb_10y_bp": 5,
    "ktb_30y_bp": 0
  },
  "short_term_shock_rationale": "기준금리 +25bp(kr_rate 단기)의 일부만 3년물에 추가 반영(+10bp), 장기물은 발행 축소·ALM 수요로 +5/0bp — 하우스 밴드 상단 근처",
  "data_gaps": [
    "하우스 2곳 동일 주간(신한·미래에셋) + NH(2026-05, 구조적 참고)",
    "ktb_10y·ktb_30y는 snapshot 미수집 → 웹확인(이투데이 2026-10-23 마감 보도), 금투협 원자료 대조 미실시",
    "10/24 이후 마감값 미확인",
    "11월 국고채 발행계획·2027년 발행 총량 미확인",
    "10월 외국인 국채 수급 미확인",
    "국고채발행액: 기준일 2026-08-31, 55일 경과(stale)"
  ],
  "sources": [
    "data/latest_snapshot.json (data/manual/ecos100_20261025.yaml, ECOS 100대 통계지표 수기 입력)",
    "https://www.etoday.co.kr/news/view/2639582",
    "https://www.youthdaily.co.kr/news/article.html?no=228792",
    "https://www.specialtimes.co.kr/news/articleView.html?idxno=477775",
    "https://www.specialtimes.co.kr/news/articleView.html?idxno=477335",
    "https://eiec.kdi.re.kr/policy/materialView.do?num=287718",
    "https://www.heraldk.com/article/2026042822293556209",
    "knowledge/view_cards/20261022_신한_10월금통위.json",
    "knowledge/view_cards/20261023_신한_WeeklyGuideBook.json",
    "knowledge/view_cards/20260526_NH_2026하반기FICC채권전망.json",
    "knowledge/view_cards/20261022_미래_FixedIncomeComment_10월금통위.json",
    "knowledge/view_cards/20261023_미래_MacroWeekAhead.json",
    "knowledge/view_cards/20261026_신한_2027전망P3_정책금융취약성.json",
    "knowledge/view_cards/20261026_신한_2027전망P4_주요국한국경제.json"
  ]
}
