{
  "topic_id": "us_alt_re",
  "as_of": "2026-10-25",
  "current": {
    "indicators": [
      {
        "series_id": "us_cmbs_delinquency_trepp",
        "name": "미국 CMBS 연체율(Trepp, 전체)",
        "value": 8.02,
        "unit": "%",
        "as_of": "2026-09-30",
        "value_flag": "웹확인",
        "source": "https://www.scotsmanguide.com/news/cmbs-delinquencies-reach-highest-level-since-2020/",
        "stale": false,
        "chg_1m": 0.17,
        "chg_unit": "%p"
      },
      {
        "series_id": "us_cmbs_office_delinquency_trepp",
        "name": "미국 CMBS 오피스 연체율(Trepp)",
        "value": 12.16,
        "unit": "%",
        "as_of": "2026-09-30",
        "value_flag": "웹확인",
        "source": "https://www.scotsmanguide.com/news/cmbs-delinquencies-reach-highest-level-since-2020/",
        "stale": false
      },
      {
        "series_id": "us_cmbs_multifamily_delinquency_trepp",
        "name": "미국 CMBS 멀티패밀리 연체율(Trepp)",
        "value": 8.04,
        "unit": "%",
        "as_of": "2026-09-30",
        "value_flag": "웹확인",
        "source": "https://www.scotsmanguide.com/news/cmbs-delinquencies-reach-highest-level-since-2020/",
        "stale": false
      },
      {
        "series_id": "us_cmbs_delinquency_kbra",
        "name": "KBRA 등급 CMBS 30일+ 연체율",
        "value": 7.7,
        "unit": "%",
        "as_of": "2026-09-30",
        "value_flag": "웹확인",
        "source": "https://www.kbra.com/publications/jXhmdtGY",
        "stale": false,
        "chg_1m": 0.09,
        "chg_unit": "%p"
      },
      {
        "series_id": "us_cre_cppi_greenstreet_yoy",
        "name": "Green Street CPPI(전체) 전년비",
        "value": 5.2,
        "unit": "%",
        "as_of": "2026-07-31",
        "value_flag": "웹확인",
        "source": "https://www.orionprop.com/?p=32393",
        "stale": true
      },
      {
        "series_id": "us_sloos_cre_net_tightening",
        "name": "SLOOS CRE 대출기준 강화 순응답비율",
        "value": null,
        "unit": "%",
        "as_of": null,
        "value_flag": "미확인",
        "source": "https://www.federalreserve.gov/data/documents/sloos-202607.pdf"
      },
      {
        "series_id": "us_cre_cap_rate",
        "name": "미국 CRE 캡레이트(전체)",
        "value": null,
        "unit": "%",
        "as_of": null,
        "value_flag": "미확인"
      }
    ],
    "summary": "[사실] snapshot에 미국 CRE API 데이터 없음(API 데이터 미수집) — 현황은 전부 웹확인. [사실] Trepp CMBS 연체율 8.02%(2026-09, 전월 7.85%, 2020년 이후 최고) — 대형 SASB 대출 5건이 상승 주도, 오피스 12.16%·멀티패밀리 8.04%(2026-09). KBRA 기준 7.7%(2026-09). [사실] Green Street CPPI 전년비 +5.2%(2026-07)이나 2022 고점 대비 약 −14%, 오피스 약 −34% — 기준일 2026-07-31, 86일 경과(월별 45일 기준 초과, stale 경고). [사실] SLOOS 2026-07(2Q 대상): 은행 CRE 대출기준 대체로 완화, 수요 보합. [사실] Fed FSR(2026-05-08): CRE 가격 안정화, 1년 내 대규모 만기도래로 강제매각 가능성 경고. [판단] '가격 완만 회복 vs 신용 악화(오피스·멀티패밀리)' 괴리 국면, UST10Y ~5.0%에서 캡레이트 추가 압축 여지 제한."
  },
  "short_term": {
    "horizon": "3-6M",
    "direction": "보합~소폭 약세(섹터 차별화)",
    "view": "[판단] FOMC 매파적 동결·UST10Y 4.90~5.15% 밴드(신한 단기 전망) 하에서 캡레이트는 하방 경직적 — 전체 가격은 보합, 오피스·노후 멀티패밀리는 만기 미상환발 연체 확대로 약세 지속. [판단] 산업·리테일은 상대 견조, 데이터센터는 수요 견조하나 밸류 부담. [하우스] 신한(20261023_신한_WeeklyGuideBook p.12): 상장 리츠 기준 리테일 유리, 데이터센터 회복 제한, 오피스 부진(확신도 낮음, 사모 부동산 직접 언급 아님).",
    "drivers": [
      "[사실] Trepp CMBS 연체율 8.02%(2026-09) 상승, 대형 SASB 대출의 비정상·압류 전환이 주도",
      "[사실] Fed FSR(2026-05): 향후 1년 CRE 만기 집중 → 강제매각 리스크",
      "[사실] SLOOS(2026-07): 은행 CRE 대출기준 완화·수요 보합 — 리파이낸싱 경로 일부 개선",
      "[사실] Green Street: '끈적한 캡레이트'로 가격 상승 폭 제한(2026-06~07 보도)",
      "[판단] UST10Y ~5.0% 고착 시 리파이낸싱 갭 지속; 10월 SLOOS(11월 초 발표 예정) 확인 필요",
      "[하우스] 신한 상장 리츠 뷰: 리테일 > 데이터센터·오피스(20261023_신한_WeeklyGuideBook, 확신 낮음)"
    ],
    "confidence": "중간"
  },
  "long_term": {
    "horizon": "1-3Y",
    "scenarios": [
      {
        "name": "Base",
        "prob": 0.55,
        "narrative": "[판단] UST10Y 완만 하락(가정 −25bp)으로 캡레이트 소폭 하락, 가격은 연 한 자릿수 초반 회복. 오피스는 손실 인식·할인매각이 2027년까지 이어지고, 산업·주거·데이터센터 중심 회복의 섹터 양극화 지속.",
        "factor_shocks": {
          "us_cre_cap_rate_bp": -10
        },
        "shock_rationale": "UST10Y −25bp 가정 × 전이율 약 0.4(신용 리스크 프리미엄이 일부 상쇄) ≈ −10bp; us-fixed-income Base(10Y 보합~하락)와 정합"
      },
      {
        "name": "Bull",
        "prob": 0.2,
        "narrative": "[판단] 인플레 둔화로 연준 재인하·UST10Y 큰 폭 하락(가정 −75bp), 거래량 회복과 리파이낸싱 원활화로 캡레이트 의미 있게 압축, 오피스도 바닥 확인.",
        "factor_shocks": {
          "us_cre_cap_rate_bp": -35
        },
        "shock_rationale": "UST10Y −75bp 가정 × 전이율 약 0.45 ≈ −35bp(스프레드 정상화 일부 포함)"
      },
      {
        "name": "Bear",
        "prob": 0.25,
        "narrative": "[판단] 인플레 재가속·추가 인상 우려로 UST10Y 상승(가정 +50bp), 만기도래 대출의 리파이낸싱 실패·강제매각 확대, CMBS 연체율 추가 상승과 가격 재하락.",
        "factor_shocks": {
          "us_cre_cap_rate_bp": 45
        },
        "shock_rationale": "UST10Y +50bp 가정 × 전이율 약 0.6 = +30bp + 신용·유동성 프리미엄 +15bp ≈ +45bp; us-fixed-income Bear(10Y 상승)와 방향 일치"
      }
    ]
  },
  "house_views": {
    "consensus": "[하우스] 신한투자증권 1곳(20261023_신한_WeeklyGuideBook p.12): 상장 리츠 기준 고금리 환경에서 리테일 리츠 유리, 데이터센터 회복 제한, 오피스 부진 — 단기 중립, 확신도 낮음. 상장 리츠 시각이므로 사모 CRE 판단에는 참고 수준으로만 반영.",
    "divergence": "하우스 1곳뿐이라 이견 비교 불가. [판단] 신한의 데이터센터 신중론은 공개 운용사 자료의 데이터센터 선호와 방향이 다르나, 상장 리츠 밸류에이션 vs 사모 펀더멘털 차이로 해석.",
    "cards_used": [
      "20261023_신한_WeeklyGuideBook"
    ]
  },
  "short_term_factor_shocks": {
    "us_cre_cap_rate_bp": 5
  },
  "short_term_shock_rationale": "UST10Y 단기 보합(4.90~5.15% 밴드, 매파적 동결) → 금리발 변화 ≈0, 오피스·멀티패밀리 연체 확대에 따른 리스크 프리미엄 +5bp(판단)",
  "data_gaps": [
    "API 데이터 미수집 — snapshot에 미국 CRE 지표 없음, 전부 웹확인",
    "Green Street CPPI 기준일 2026-07-31, 86일 경과(stale) — 8~9월 수치 미확인",
    "SLOOS 순응답비율 수치 미확인(2026-07 정성 결과만), 10월 SLOOS 미발표",
    "미국 CRE 캡레이트 수준 미확인",
    "CRE 만기 도래 규모(maturity wall) 수치 미확인",
    "하우스 뷰 부족 — 신한 1곳, 그마저 상장 리츠 시각"
  ],
  "sources": [
    "https://www.scotsmanguide.com/news/cmbs-delinquencies-reach-highest-level-since-2020/",
    "https://www.kbra.com/publications/jXhmdtGY",
    "https://www.orionprop.com/?p=32393",
    "https://www.connectcre.com/stories/green-street-sticky-cap-rates-keep-pricing-gains-modest/",
    "https://www.federalreserve.gov/data/documents/sloos-202607.pdf",
    "https://infobytes.orrick.com/2026-05-22/fed-releases-its-semiannual-financial-stability-report/",
    "knowledge/view_cards/20261023_신한_WeeklyGuideBook.json (p.12)"
  ]
}