{
  "topic_id": "us_alt_pd",
  "as_of": "2026-10-25",
  "current": {
    "indicators": [
      {
        "series_id": "us_pc_default_fitch_ttm",
        "name": "Fitch 미국 Private Credit 부도율(TTM, 부실교환 포함)",
        "value": 6.3,
        "unit": "%",
        "as_of": "2026-08-31",
        "value_flag": "웹확인",
        "source": "https://www.fundssociety.com/en/news/alternatives/u-s-private-credit-default-rate-continues-to-climb/",
        "stale": true,
        "chg_1m": 0.2,
        "chg_unit": "%p"
      },
      {
        "series_id": "us_pc_default_proskauer",
        "name": "Proskauer Private Credit Default Index(분기)",
        "value": 2.51,
        "unit": "%",
        "as_of": "2026-06-30",
        "value_flag": "웹확인",
        "source": "https://www.proskauer.com/report/proskauers-private-credit-default-index-reveals-rate-of-251-for-q2-2026",
        "stale": true
      },
      {
        "series_id": "us_bdc_nonaccrual_top10",
        "name": "상위 10개 BDC 비발생대출 비중",
        "value": null,
        "unit": "%",
        "as_of": null,
        "value_flag": "미확인",
        "source": "https://angelinvestorsnetwork.com/market-analysis/bdc-non-accrual-rates-q2-2026-data"
      },
      {
        "series_id": "us_bdc_pik_share_nmfc",
        "name": "New Mountain Finance PIK 이자 비중(총투자수익 대비)",
        "value": 8.81,
        "unit": "%",
        "as_of": "2026-06-30",
        "value_flag": "웹확인",
        "source": "https://altss.com/blog/nmfc-pik-interest-noncash-dividends-investment-income",
        "stale": true
      }
    ],
    "summary": "[사실] snapshot에 Private Credit API 데이터 없음(API 데이터 미수집). [사실] Fitch 미국 Private Credit 부도율(TTM) 6.3%(2026-08, 7월 6.1%, 사상 최고, 4월 이후 6%대) — 기준일 2026-08-31, 55일 경과(월별 45일 기준 초과, stale). [사실] Proskauer 지수 2.51%(2026 2Q, 1Q 2.73%) — 기준일 2026-06-30, 117일 경과(stale; 3Q 발표 임박). 두 지표는 정의 차이(Fitch는 부실교환·만기연장 포함)로 직접 비교 불가. [사실] Fed FSR(2026-05) 관련 보도: 영구형 BDC 환매가 2026 1Q 처음으로 신규 유입 초과(2차 출처). [사실] NMFC PIK 이자 비중 8.81%(PIK+비현금배당 16.75%, 2026 2Q). [판단] 표면 부도율은 완만하나 부실교환·PIK로 이연된 스트레스가 누적 — 고금리 장기화 시 실현 손실 확대 위험."
  },
  "short_term": {
    "horizon": "3-6M",
    "direction": "부도율 소폭 상승",
    "view": "[판단] FFR 3.75~4.00%(9월 인상 후)·매파적 동결로 변동금리 차주의 이자보상배율 압박 지속 → Fitch 기준 부도율 6%대 중반으로 소폭 상승, 부실교환·PIK 전환 증가. [판단] 은행권 복귀·스프레드 축소 경쟁은 신규 딜 조건 약화 요인이나 단기 부도에는 영향 제한.",
    "drivers": [
      "[사실] Fitch TTM 부도율 6.3%(2026-08), 7월 6.1%에서 상승; 12개월간 89개 발행사·109건 부도 이벤트",
      "[사실] Proskauer 2.51%(2026 2Q) — EBITDA $25~49.9m 구간만 3.4%로 상승",
      "[사실] 영구형 BDC 환매 > 유입(2026 1Q, Fed FSR 관련 2차 출처), 5% 분기 환매 한도 적용",
      "[사실] Barings BDC 일부 대출 PIK분 비발생 처리 등 개별 BDC 스트레스(2026 2Q 10-Q)",
      "[판단] 단기금리 고착(FFR 3.75~4.00%)이 변동금리 차주 부담의 핵심",
      "[판단] BDC 업계 비발생대출 비중 공식 집계 미확인(2차 출처 3.95%는 검증 불가)"
    ],
    "confidence": "중간"
  },
  "long_term": {
    "horizon": "1-3Y",
    "scenarios": [
      {
        "name": "Base",
        "prob": 0.55,
        "narrative": "[판단] 금리 완만 하락(UST10Y 가정 −25bp, 단기금리도 점진 인하)으로 이자부담이 서서히 완화되나, 2021~22 빈티지 부실 처리로 부도율은 고점 부근에서 소폭 추가 상승 후 정체.",
        "factor_shocks": {
          "us_pd_default_pp": 0.3
        },
        "shock_rationale": "단기금리 하락은 시차를 두고 반영, 부실 빈티지 소화로 Fitch 기준 +0.3%p(판단)"
      },
      {
        "name": "Bull",
        "prob": 0.2,
        "narrative": "[판단] 연준 재인하·UST10Y −75bp(가정), 리파이낸싱 창구 재개로 부실교환 감소, 부도율 하락.",
        "factor_shocks": {
          "us_pd_default_pp": -0.8
        },
        "shock_rationale": "단기금리 −100bp 내외 가정 시 이자보상배율 개선 → −0.8%p(판단)"
      },
      {
        "name": "Bear",
        "prob": 0.25,
        "narrative": "[판단] 금리 재상승(UST10Y +50bp 가정)·경기 둔화로 변동금리 차주 부도 급증, BDC 환매 압력과 밸류에이션 마크다운 동반.",
        "factor_shocks": {
          "us_pd_default_pp": 2.0
        },
        "shock_rationale": "금리 상승 + 경기 둔화 결합 시 Fitch 기준 8%대 → +2.0%p(판단); us-fixed-income Bear와 방향 일치"
      }
    ]
  },
  "house_views": {
    "consensus": "하우스 뷰 없음 — 최근 30일(2026-09-25~10-25) 담당 topic 카드 0개.",
    "divergence": "해당 없음(하우스 뷰 없음).",
    "cards_used": []
  },
  "short_term_factor_shocks": {
    "us_pd_default_pp": 0.3
  },
  "short_term_shock_rationale": "FFR 3.75~4.00% 고착·매파적 동결로 이자부담 지속 → Fitch 기준 최근 월 +0.1~0.2%p 추세 연장 시 3~6개월 +0.3%p(판단)",
  "data_gaps": [
    "API 데이터 미수집 — snapshot에 Private Credit 지표 없음",
    "하우스 뷰 부족 — 하우스 뷰 없음(30일 내 담당 topic 카드 0개)",
    "Fitch 9월·Proskauer 3Q 수치 미발표/미확인; Fitch 값은 언론 보도(보조 출처) — 기준일 2026-08-31(55일 경과, stale)",
    "Proskauer 기준일 2026-06-30(117일 경과, stale)",
    "BDC 업계 비발생대출·PIK 비중 공식 집계 미확인(개별 10-Q만)",
    "직접대출 스프레드 수준 미확인",
    "Fed FSR 원문 미확인(2차 출처 요약)"
  ],
  "sources": [
    "https://www.fundssociety.com/en/news/alternatives/u-s-private-credit-default-rate-continues-to-climb/",
    "https://cryptobriefing.com/us-private-debt-default-rate-record-fitch/",
    "https://www.proskauer.com/report/proskauers-private-credit-default-index-reveals-rate-of-251-for-q2-2026",
    "https://altss.com/blog/nmfc-pik-interest-noncash-dividends-investment-income",
    "https://angelinvestorsnetwork.com/market-analysis/bdc-non-accrual-rates-q2-2026-data",
    "https://infobytes.orrick.com/2026-05-22/fed-releases-its-semiannual-financial-stability-report/"
  ]
}